{
  "package_id": "phase1-sample",
  "created_at": "2026-04-27T00:00:00Z",
  "source_directory": "/tmp/source",
  "source_count": 1,
  "image_count": 2,
  "label_count": 2,
  "train_image_count": 1,
  "val_image_count": 1,
  "class_map": {
    "0": "person"
  },
  "sources": [
    {
      "source_path": "/tmp/source/video.mp4",
      "clip_id": "clip-1",
      "run_id": "run-1",
      "vision_job_id": "job-1",
      "dataset_root": "/tmp/source",
      "image_count": 2,
      "train_image_count": 1,
      "val_image_count": 1,
      "selection_reason": "bootstrap"
    }
  ],
  "entries": [
    {
      "image_path": "images/frame_0001.jpg",
      "label_path": "labels/frame_0001.txt",
      "split": "train",
      "frame_num": 1,
      "timestamp_sec": 0.1,
      "source_timestamp_sec": 0.1,
      "target_detection_count": 1,
      "source_path": "/tmp/source/video.mp4",
      "source_clip_id": "clip-1",
      "source_run_id": "run-1",
      "source_vision_job_id": "job-1"
    }
  ]
}
